{
  "compactified_points": [
    "1/2",
    "1/5",
    "1/10"
  ],
  "format_version": "0.3.0",
  "hankel_leading_principal_minors": [
    "4/5",
    "43/2500",
    "9/6250000",
    "0"
  ],
  "hankel_matrix": [
    [
      "4/5",
      "3/10",
      "67/500",
      "321/5000"
    ],
    [
      "3/10",
      "67/500",
      "321/5000",
      "1579/50000"
    ],
    [
      "67/500",
      "321/5000",
      "1579/50000",
      "1569/100000"
    ],
    [
      "321/5000",
      "1579/50000",
      "1569/100000",
      "39127/5000000"
    ]
  ],
  "localizing_leading_principal_minors": [
    "1/2",
    "459/62500",
    "81/156250000",
    "0"
  ],
  "localizing_matrix": [
    [
      "1/2",
      "83/500",
      "349/5000",
      "1631/50000"
    ],
    [
      "83/500",
      "349/5000",
      "1631/50000",
      "1589/100000"
    ],
    [
      "349/5000",
      "1631/50000",
      "1589/100000",
      "39323/5000000"
    ],
    [
      "1631/50000",
      "1589/100000",
      "39323/5000000",
      "195829/50000000"
    ]
  ],
  "moments": [
    "4/5",
    "3/10",
    "67/500",
    "321/5000",
    "1579/50000",
    "1569/100000",
    "39127/5000000",
    "195441/50000000",
    "976819/500000000",
    "195333/200000000",
    "24415087/50000000000"
  ],
  "signed_differences": {
    "0,0": "4/5",
    "0,1": "3/10",
    "0,2": "67/500",
    "0,3": "321/5000",
    "0,4": "1579/50000",
    "1,0": "1/2",
    "1,1": "83/500",
    "1,2": "349/5000",
    "1,3": "1631/50000",
    "1,4": "1589/100000",
    "2,0": "167/500",
    "2,1": "481/5000",
    "2,2": "1859/50000",
    "2,3": "1673/100000",
    "2,4": "40127/5000000",
    "3,0": "1189/5000",
    "3,1": "2951/50000",
    "3,2": "409/20000",
    "3,3": "43523/5000000",
    "3,4": "203869/50000000",
    "4,0": "8939/50000",
    "4,1": "3857/100000",
    "4,2": "58727/5000000",
    "4,3": "231361/50000000",
    "4,4": "1045379/500000000"
  },
  "spectrum": [
    "1",
    "4",
    "9"
  ],
  "status": "exact-finite-toy-certificate-not-evidence-for-RH",
  "weights": [
    "1/2",
    "1/5",
    "1/10"
  ],
  "x0": "1"
}
